{
  "schema_version": "l9.corpus-event/v1",
  "producer_id": "Quantum-L9/l9-ci-core",
  "producer_contract": "l9.core-gate-event/v1",
  "sdk_contract": "l9.integration-contract/v1",
  "event_id": "gate-sensitive-100",
  "event_class": "gate_outcome",
  "event_time": "2026-07-17T12:00:00Z",
  "snapshot_or_run_id": "run-sensitive-100",
  "redaction_status": "producer_redacted",
  "limitations": [],
  "unknowns": [],
  "lineage": {
    "producer_event_hash": "bbbbbbbbbbbbbbbbbbbbbbbbbbbbbbbbbbbbbbbbbbbbbbbbbbbbbbbbbbbbbbbb",
    "parent_event_ids": []
  },
  "payload": {
    "authorization": "Bearer secret-token-value-123456789"
  }
}
